{
  "schemaVersion": 1,
  "world": "Europe",
  "gameBuild": "25677108",
  "units": "meters",
  "count": 92,
  "objects": [
    {
      "id": "f31ebc962fe1",
      "kind": "equipment-vendor",
      "class": "B_EquipmentVendor_C",
      "position": [
        -11634.5,
        -5820.334,
        -901.7528
      ],
      "yaw": 451.97,
      "faction": "Charlie"
    },
    {
      "id": "355212185b0e",
      "kind": "equipment-vendor",
      "class": "B_EquipmentVendor_C",
      "position": [
        -9330.7956,
        -8620.16,
        -801.8009
      ],
      "yaw": -325.9,
      "faction": "Charlie"
    },
    {
      "id": "628ff15ea6e8",
      "kind": "equipment-vendor",
      "class": "B_EquipmentVendor_C",
      "position": [
        -7806.275,
        -2915.871,
        -826.6432
      ],
      "yaw": 42.51,
      "faction": "Alpha"
    },
    {
      "id": "11d1d49fe4ee",
      "kind": "equipment-vendor",
      "class": "B_EquipmentVendor_C",
      "position": [
        -7414.444,
        -10016.523,
        -871.1513
      ],
      "yaw": 307.86,
      "faction": "Bravo"
    },
    {
      "id": "4452d9f33b18",
      "kind": "equipment-vendor",
      "class": "B_EquipmentVendor_C",
      "position": [
        -7352.958,
        -7340.788,
        -905.2168
      ],
      "yaw": 204.9,
      "faction": "Charlie"
    },
    {
      "id": "a2bd1322bc30",
      "kind": "equipment-vendor",
      "class": "B_EquipmentVendor_C",
      "position": [
        -6934.9694,
        -3830.218,
        -831.0137
      ],
      "yaw": 381.52,
      "faction": "Alpha"
    },
    {
      "id": "6a4bd9062f24",
      "kind": "equipment-vendor",
      "class": "B_EquipmentVendor_C",
      "position": [
        -4116.3434,
        -2370.9597,
        -833.5547
      ],
      "yaw": 372.94,
      "faction": "Bravo"
    },
    {
      "id": "a71284dbf501",
      "kind": "equipment-vendor",
      "class": "B_EquipmentVendor_C",
      "position": [
        -2409.0355,
        -6546.6344,
        -862.6547
      ],
      "yaw": 294.65,
      "faction": "Bravo"
    },
    {
      "id": "b5d3ffcd4538",
      "kind": "vehicle-vendor",
      "class": "B_VehicleVendor_C",
      "position": [
        -11638.302,
        -5833.1156,
        -901.748
      ],
      "yaw": 51.13,
      "faction": "Charlie"
    },
    {
      "id": "d067997d7426",
      "kind": "vehicle-vendor",
      "class": "B_VehicleVendor_C",
      "position": [
        -9317.2175,
        -8602.0544,
        -801.7318
      ],
      "yaw": -259.7,
      "faction": "Charlie"
    },
    {
      "id": "127fd7682ed7",
      "kind": "vehicle-vendor",
      "class": "B_VehicleVendor_C",
      "position": [
        -7817.6706,
        -2944.3138,
        -826.615
      ],
      "yaw": -4.35,
      "faction": "Alpha"
    },
    {
      "id": "db9d0e294ea8",
      "kind": "vehicle-vendor",
      "class": "B_VehicleVendor_C",
      "position": [
        -7421.6206,
        -9988.071,
        -872.4358
      ],
      "yaw": 232.62,
      "faction": "Bravo"
    },
    {
      "id": "c1610717a89f",
      "kind": "vehicle-vendor",
      "class": "B_VehicleVendor_C",
      "position": [
        -7325.8494,
        -7331.804,
        -904.9801
      ],
      "yaw": -207.39,
      "faction": "Charlie"
    },
    {
      "id": "200a937e7d76",
      "kind": "vehicle-vendor",
      "class": "B_VehicleVendor_C",
      "position": [
        -6939.059,
        -3831.6984,
        -831.2502
      ],
      "yaw": -15.62,
      "faction": "Alpha"
    },
    {
      "id": "39578be959d8",
      "kind": "vehicle-vendor",
      "class": "B_VehicleVendor_C",
      "position": [
        -4111.5922,
        -2368.1664,
        -833.5547
      ],
      "yaw": 38.91,
      "faction": "Bravo"
    },
    {
      "id": "e94f18e16e39",
      "kind": "vehicle-vendor",
      "class": "B_VehicleVendor_C",
      "position": [
        -2421.9734,
        -6520.543,
        -862.5377
      ],
      "yaw": 240,
      "faction": "Bravo"
    },
    {
      "id": "fe13552a5aa9",
      "kind": "safe-zone",
      "class": "B_SafeZone_C",
      "position": [
        -11695.115,
        -5699.24,
        -853.1844
      ],
      "yaw": 335.57,
      "scale": [
        750,
        750,
        750
      ],
      "faction": "Charlie",
      "tags": [
        "State.Location.SafeZone.Charlie"
      ]
    },
    {
      "id": "97908696f863",
      "kind": "safe-zone",
      "class": "B_SafeZone_C",
      "position": [
        -9213.3156,
        -8553.9075,
        -807.8644
      ],
      "yaw": -234.03,
      "scale": [
        750,
        750,
        750
      ],
      "faction": "Charlie",
      "tags": [
        "State.Location.SafeZone.Charlie"
      ]
    },
    {
      "id": "2ff87a588893",
      "kind": "safe-zone",
      "class": "B_SafeZone_C",
      "position": [
        -7798.214,
        -2989.7816,
        -824.1512
      ],
      "scale": [
        750,
        750,
        750
      ],
      "faction": "Alpha"
    },
    {
      "id": "a7944403255a",
      "kind": "safe-zone",
      "class": "B_SafeZone_C",
      "position": [
        -7366.37,
        -9991.288,
        -843.9505
      ],
      "yaw": 335.57,
      "scale": [
        750,
        750,
        750
      ],
      "faction": "Bravo",
      "tags": [
        "State.Location.SafeZone.Bravo"
      ]
    },
    {
      "id": "8484b8c16773",
      "kind": "safe-zone",
      "class": "B_SafeZone_C",
      "position": [
        -7349.069,
        -7336.191,
        -897.783
      ],
      "yaw": 335.57,
      "scale": [
        750,
        750,
        750
      ],
      "faction": "Charlie",
      "tags": [
        "State.Location.SafeZone.Charlie"
      ]
    },
    {
      "id": "abd18e412e55",
      "kind": "safe-zone",
      "class": "B_SafeZone_C",
      "position": [
        -6938.774,
        -3829.3247,
        -805.7312
      ],
      "yaw": 335.57,
      "scale": [
        750,
        750,
        750
      ],
      "faction": "Alpha"
    },
    {
      "id": "71b4b6e45384",
      "kind": "safe-zone",
      "class": "B_SafeZone_C",
      "position": [
        -4130.2594,
        -2408.838,
        -773.7764
      ],
      "yaw": 335.57,
      "scale": [
        750,
        750,
        750
      ],
      "faction": "Bravo",
      "tags": [
        "State.Location.SafeZone.Bravo"
      ]
    },
    {
      "id": "c551f5162d67",
      "kind": "safe-zone",
      "class": "B_SafeZone_C",
      "position": [
        -2512.9733,
        -6505.41,
        -862.6789
      ],
      "yaw": 342.96,
      "scale": [
        750,
        750,
        750
      ],
      "faction": "Bravo",
      "tags": [
        "State.Location.SafeZone.Bravo"
      ]
    },
    {
      "id": "a1ce4daba938",
      "kind": "safe-zone-camera",
      "class": "B_SafeZoneCam_C",
      "position": [
        -11671.801,
        -5655.8175,
        -743.5651
      ],
      "yaw": 31.25
    },
    {
      "id": "ec94c2458195",
      "kind": "safe-zone-camera",
      "class": "B_SafeZoneCam_C",
      "position": [
        -9264.067,
        -8604.861,
        -600
      ],
      "yaw": -306.21
    },
    {
      "id": "8c3beba14eb6",
      "kind": "safe-zone-camera",
      "class": "B_SafeZoneCam_C",
      "position": [
        -7824.4906,
        -2940.536,
        -650
      ]
    },
    {
      "id": "966ace40eace",
      "kind": "safe-zone-camera",
      "class": "B_SafeZoneCam_C",
      "position": [
        -7343.056,
        -9947.8656,
        -734.3312
      ],
      "yaw": 31.25
    },
    {
      "id": "ca1ef45baf2a",
      "kind": "safe-zone-camera",
      "class": "B_SafeZoneCam_C",
      "position": [
        -7286.1275,
        -7335.885,
        -788.1638
      ],
      "yaw": 31.25
    },
    {
      "id": "1790adaea150",
      "kind": "safe-zone-camera",
      "class": "B_SafeZoneCam_C",
      "position": [
        -6915.46,
        -3785.902,
        -696.112
      ],
      "yaw": 31.25
    },
    {
      "id": "adf673b9e303",
      "kind": "safe-zone-camera",
      "class": "B_SafeZoneCam_C",
      "position": [
        -4000.824,
        -2386.8684,
        -664.1571
      ],
      "yaw": 31.25
    },
    {
      "id": "5936ed22df37",
      "kind": "safe-zone-camera",
      "class": "B_SafeZoneCam_C",
      "position": [
        -2495.4323,
        -6459.351,
        -767.4596
      ],
      "yaw": 38.63
    },
    {
      "id": "4ff83f2874d5",
      "kind": "spawn-manager",
      "class": "B_SpawnManager_C",
      "position": [
        -11646.065,
        -5823.8906,
        -900.9313
      ],
      "yaw": -16.55,
      "faction": "Charlie"
    },
    {
      "id": "ee96fd8475a3",
      "kind": "spawn-manager",
      "class": "B_SpawnManager_C",
      "position": [
        -9356.87,
        -8611.271,
        -799.6873
      ],
      "yaw": -25.22,
      "faction": "Charlie"
    },
    {
      "id": "bf0d82bd1c12",
      "kind": "spawn-manager",
      "class": "B_SpawnManager_C",
      "position": [
        -7818.563,
        -2897.9978,
        -826.3361
      ],
      "yaw": -56.42,
      "faction": "Alpha"
    },
    {
      "id": "d0a3ad4f92e7",
      "kind": "spawn-manager",
      "class": "B_SpawnManager_C",
      "position": [
        -7420.0375,
        -10000.421,
        -871.9321
      ],
      "yaw": 159.22,
      "faction": "Bravo"
    },
    {
      "id": "adf0a8407ece",
      "kind": "spawn-manager",
      "class": "B_SpawnManager_C",
      "position": [
        -7341.0306,
        -7353.169,
        -905.8071
      ],
      "yaw": 85.74,
      "faction": "Charlie"
    },
    {
      "id": "2260d0ba093a",
      "kind": "spawn-manager",
      "class": "B_SpawnManager_C",
      "position": [
        -6926.219,
        -3818.2588,
        -831.3329
      ],
      "yaw": -84.33,
      "faction": "Alpha"
    },
    {
      "id": "5828c2dd14b6",
      "kind": "spawn-manager",
      "class": "B_SpawnManager_C",
      "position": [